{
  "$schema": "https://json-schema.org/draft/2020-12/schema",
  "$id": "https://raw.githubusercontent.com/kirimine170/MIRAI_labo-games/main/schemas/session-log.schema.json",
  "title": "HackSick Academy pseudonymous session log",
  "type": "object",
  "additionalProperties": false,
  "required": [
    "schema_version",
    "session_id",
    "participant_key",
    "grade",
    "study_id",
    "game_id",
    "variant",
    "defect_id",
    "started_at",
    "events"
  ],
  "properties": {
    "schema_version": {"const": "1.0.0"},
    "session_id": {"type": "string", "pattern": "^S-[A-Za-z0-9_-]{4,64}$"},
    "participant_key": {"type": "string", "pattern": "^P-[A-Za-z0-9_-]{4,64}$"},
    "grade": {"enum": ["\u5c0f3", "\u5c0f4", "\u5c0f5", "\u5c0f6", "\u4e2d1", "\u4e2d2", "\u4e2d3"]},
    "study_id": {"type": "string", "pattern": "^[A-Za-z0-9_-]{3,64}$"},
    "game_id": {"type": "string", "pattern": "^[0-9]{2}_[0-9]{2}$"},
    "variant": {"enum": ["complete", "defective", "no-defect"]},
    "defect_id": {
      "type": ["string", "null"],
      "pattern": "^[0-9]{2}_[0-9]{2}-D[0-9]{2}$"
    },
    "started_at": {"type": "string", "format": "date-time"},
    "events": {
      "type": "array",
      "minItems": 1,
      "items": {"$ref": "#/$defs/event"}
    }
  },
  "$defs": {
    "event": {
      "type": "object",
      "additionalProperties": false,
      "required": ["sequence", "elapsed_ms", "type", "payload"],
      "properties": {
        "sequence": {"type": "integer", "minimum": 1},
        "elapsed_ms": {"type": "integer", "minimum": 0},
        "type": {
          "enum": [
            "session_started",
            "symptom_observed",
            "hypothesis_recorded",
            "code_change",
            "test_run",
            "hint_requested",
            "judgement_recorded",
            "task_completed"
          ]
        },
        "payload": {"$ref": "#/$defs/payload"}
      }
    },
    "payload": {
      "type": "object",
      "additionalProperties": false,
      "properties": {
        "observation": {"type": "string", "maxLength": 500},
        "hypothesis": {"type": "string", "maxLength": 500},
        "file": {"type": "string", "maxLength": 200},
        "change_summary": {"type": "string", "maxLength": 500},
        "test_id": {"type": "string", "maxLength": 80},
        "result": {"enum": ["pass", "fail", "not-run"]},
        "hint_level": {"type": "integer", "minimum": 1, "maximum": 5},
        "judgement": {"enum": ["defect-found", "no-defect", "unsure"]},
        "completed": {"type": "boolean"}
      }
    }
  }
}
